{
 "schema": "polars-telemetry/profile@1",
 "polars_version": "2.1.0",
 "polars_telemetry_version": "0.10.1",
 "query_id": "01a10000-0000-7000-8000-000000000000",
 "label": null,
 "fingerprint": "94b7e38a9c1e",
 "started_unix_ns": 1759478400000000000,
 "wall_ms": 48.1,
 "planning_ms": null,
 "telemetry_ms": null,
 "cpu_ms": 4.7883,
 "result_rows": 2,
 "call_site": {
  "filepath": "/srv/app/pipeline.py",
  "lineno": 142,
  "function": "build_report"
 },
 "failed": null,
 "redacted": null,
 "diagnostics": {
  "parallel_efficiency": 0.012443711018711019,
  "cpu_count": 8,
  "join_growth": 1.0,
  "projection_efficiency": 1.0,
  "morsel_skew": 1.7899945024738866,
  "predicate_pushed": true,
  "has_table_statistics": false,
  "incomplete_nodes": 0
 },
 "plan": {
  "physical": [
   {
    "id": 4294967307,
    "kind": "InMemorySink",
    "role": "sink",
    "inputs": [
     4294967306
    ],
    "properties": {
     "type": "InMemorySink"
    },
    "metrics": {
     "total_time_ns": 46061,
     "total_polls": 51,
     "total_stolen_polls": 24,
     "total_poll_time_ns": 26691,
     "max_poll_time_ns": 2333,
     "total_state_updates": 8,
     "total_state_update_time_ns": 19370,
     "max_state_update_time_ns": 18542,
     "rows_received": 2,
     "rows_sent": 0,
     "morsels_received": 3,
     "morsels_sent": 0,
     "largest_morsel_received": 1,
     "largest_morsel_sent": 0,
     "io_total_active_ns": 0,
     "io_total_bytes_received": 0,
     "io_total_bytes_requested": 0,
     "io_total_bytes_sent": 0,
     "done": true
    }
   },
   {
    "id": 4294967306,
    "kind": "Sort",
    "role": "sort",
    "inputs": [
     4294967305
    ],
    "properties": {
     "limit": null,
     "maintain_order": false,
     "multithreaded": true,
     "slice": null,
     "sort_columns": [
      {
       "descending": false,
       "expr": "col(\"segment\")",
       "nulls_last": false
      }
     ],
     "type": "Sort"
    },
    "metrics": {
     "total_time_ns": 880881,
     "total_polls": 52,
     "total_stolen_polls": 36,
     "total_poll_time_ns": 766856,
     "max_poll_time_ns": 82016,
     "total_state_updates": 9,
     "total_state_update_time_ns": 114025,
     "max_state_update_time_ns": 111399,
     "rows_received": 2,
     "rows_sent": 2,
     "morsels_received": 1,
     "morsels_sent": 3,
     "largest_morsel_received": 2,
     "largest_morsel_sent": 1,
     "io_total_active_ns": 0,
     "io_total_bytes_received": 0,
     "io_total_bytes_requested": 0,
     "io_total_bytes_sent": 0,
     "done": true
    }
   },
   {
    "id": 4294967305,
    "kind": "SimpleProjection",
    "role": "projection",
    "inputs": [
     4294967304
    ],
    "properties": {
     "columns": [
      "_POLARS_TMP_PHYS_1",
      "_POLARS_TMP_PHYS_3",
      "_POLARS_TMP_PHYS_5"
     ],
     "type": "SimpleProjection"
    },
    "metrics": {
     "total_time_ns": 14689,
     "total_polls": 25,
     "total_stolen_polls": 12,
     "total_poll_time_ns": 13947,
     "max_poll_time_ns": 5460,
     "total_state_updates": 9,
     "total_state_update_time_ns": 742,
     "max_state_update_time_ns": 194,
     "rows_received": 2,
     "rows_sent": 2,
     "morsels_received": 1,
     "morsels_sent": 1,
     "largest_morsel_received": 2,
     "largest_morsel_sent": 2,
     "io_total_active_ns": 0,
     "io_total_bytes_received": 0,
     "io_total_bytes_requested": 0,
     "io_total_bytes_sent": 0,
     "done": true
    }
   },
   {
    "id": 4294967304,
    "kind": "GroupBy",
    "role": "aggregation",
    "inputs": [
     4294967303
    ],
    "properties": {
     "aggs_per_input": [
      [
       "col(\"revenue\").sum().alias(\"_POLARS_TMP_PHYS_3\")",
       "col(\"order_id\").count().alias(\"_POLARS_TMP_PHYS_5\")"
      ]
     ],
     "fused_agg_inputs_per_input": [
      []
     ],
     "key_per_input": [
      [
       "col(\"_POLARS_TMP_PHYS_1\")"
      ]
     ],
     "num_inputs": 1,
     "type": "GroupBy"
    },
    "metrics": {
     "total_time_ns": 877441,
     "total_polls": 84,
     "total_stolen_polls": 54,
     "total_poll_time_ns": 722762,
     "max_poll_time_ns": 82931,
     "total_state_updates": 9,
     "total_state_update_time_ns": 154679,
     "max_state_update_time_ns": 152741,
     "rows_received": 1769,
     "rows_sent": 2,
     "morsels_received": 12,
     "morsels_sent": 1,
     "largest_morsel_received": 148,
     "largest_morsel_sent": 2,
     "io_total_active_ns": 0,
     "io_total_bytes_received": 0,
     "io_total_bytes_requested": 0,
     "io_total_bytes_sent": 0,
     "done": true,
     "custom": [
      {
       "key": "group_by.estimated_groups",
       "unit": "1",
       "value": 2
      },
      {
       "key": "group_by.actual_groups",
       "unit": "1",
       "value": 2
      }
     ]
    }
   },
   {
    "id": 4294967303,
    "kind": "SimpleProjection",
    "role": "projection",
    "inputs": [
     4294967302
    ],
    "properties": {
     "columns": [
      "segment",
      "revenue",
      "order_id"
     ],
     "type": "SimpleProjection"
    },
    "metrics": {
     "total_time_ns": 36885,
     "total_polls": 29,
     "total_stolen_polls": 13,
     "total_poll_time_ns": 36470,
     "max_poll_time_ns": 7858,
     "total_state_updates": 9,
     "total_state_update_time_ns": 415,
     "max_state_update_time_ns": 59,
     "rows_received": 1769,
     "rows_sent": 1769,
     "morsels_received": 12,
     "morsels_sent": 12,
     "largest_morsel_received": 148,
     "largest_morsel_sent": 148,
     "io_total_active_ns": 0,
     "io_total_bytes_received": 0,
     "io_total_bytes_requested": 0,
     "io_total_bytes_sent": 0,
     "done": true
    }
   },
   {
    "id": 4294967302,
    "kind": "SimpleProjection",
    "role": "projection",
    "inputs": [
     4294967301
    ],
    "properties": {
     "columns": [
      "segment",
      "revenue",
      "order_id"
     ],
     "type": "SimpleProjection"
    },
    "metrics": {
     "total_time_ns": 37252,
     "total_polls": 29,
     "total_stolen_polls": 12,
     "total_poll_time_ns": 36827,
     "max_poll_time_ns": 6490,
     "total_state_updates": 9,
     "total_state_update_time_ns": 425,
     "max_state_update_time_ns": 62,
     "rows_received": 1769,
     "rows_sent": 1769,
     "morsels_received": 12,
     "morsels_sent": 12,
     "largest_morsel_received": 148,
     "largest_morsel_sent": 148,
     "io_total_active_ns": 0,
     "io_total_bytes_received": 0,
     "io_total_bytes_requested": 0,
     "io_total_bytes_sent": 0,
     "done": true
    }
   },
   {
    "id": 4294967301,
    "kind": "Select",
    "role": "map",
    "inputs": [
     4294967300
    ],
    "properties": {
     "extend_original": true,
     "selectors": [
      "(col(\"amount\") * col(\"qty\").cast(Float64)).alias(\"revenue\")"
     ],
     "type": "Select"
    },
    "metrics": {
     "total_time_ns": 213880,
     "total_polls": 29,
     "total_stolen_polls": 15,
     "total_poll_time_ns": 212903,
     "max_poll_time_ns": 50956,
     "total_state_updates": 9,
     "total_state_update_time_ns": 977,
     "max_state_update_time_ns": 211,
     "rows_received": 1769,
     "rows_sent": 1769,
     "morsels_received": 12,
     "morsels_sent": 12,
     "largest_morsel_received": 148,
     "largest_morsel_sent": 148,
     "io_total_active_ns": 0,
     "io_total_bytes_received": 0,
     "io_total_bytes_requested": 0,
     "io_total_bytes_sent": 0,
     "done": true
    }
   },
   {
    "id": 4294967300,
    "kind": "SimpleProjection",
    "role": "projection",
    "inputs": [
     4294967299
    ],
    "properties": {
     "columns": [
      "order_id",
      "amount",
      "qty",
      "segment"
     ],
     "type": "SimpleProjection"
    },
    "metrics": {
     "total_time_ns": 35151,
     "total_polls": 33,
     "total_stolen_polls": 22,
     "total_poll_time_ns": 34501,
     "max_poll_time_ns": 6138,
     "total_state_updates": 9,
     "total_state_update_time_ns": 650,
     "max_state_update_time_ns": 166,
     "rows_received": 1769,
     "rows_sent": 1769,
     "morsels_received": 12,
     "morsels_sent": 12,
     "largest_morsel_received": 148,
     "largest_morsel_sent": 148,
     "io_total_active_ns": 0,
     "io_total_bytes_received": 0,
     "io_total_bytes_requested": 0,
     "io_total_bytes_sent": 0,
     "done": true
    }
   },
   {
    "id": 4294967299,
    "kind": "EquiJoin",
    "role": "join",
    "inputs": [
     4294967297,
     4294967298
    ],
    "properties": {
     "coalesce": "JoinSpecific",
     "fused_predicate": null,
     "how": "INNER",
     "left_on": [
      "col(\"customer_id\")"
     ],
     "maintain_order": "none",
     "nulls_equal": false,
     "right_on": [
      "col(\"customer_id\")"
     ],
     "suffix": "_right",
     "type": "EquiJoin",
     "validation": "ManyToMany"
    },
    "metrics": {
     "total_time_ns": 1227977,
     "total_polls": 193,
     "total_stolen_polls": 83,
     "total_poll_time_ns": 769645,
     "max_poll_time_ns": 74506,
     "total_state_updates": 11,
     "total_state_update_time_ns": 458332,
     "max_state_update_time_ns": 349533,
     "rows_received": 1819,
     "rows_sent": 1769,
     "morsels_received": 22,
     "morsels_sent": 12,
     "largest_morsel_received": 148,
     "largest_morsel_sent": 148,
     "io_total_active_ns": 0,
     "io_total_bytes_received": 0,
     "io_total_bytes_requested": 0,
     "io_total_bytes_sent": 0,
     "done": true
    }
   },
   {
    "id": 4294967297,
    "kind": "MultiScan",
    "role": "scan",
    "inputs": [],
    "properties": {
     "deletion_files_type": null,
     "first_source": "orders.parquet",
     "has_table_statistics": false,
     "hive_columns": null,
     "include_file_paths": null,
     "num_sources": 1,
     "pre_slice": null,
     "predicate": "col(\"amount\") > 10.0",
     "predicate_file_skip_applied": null,
     "projected_file_columns": [
      "order_id",
      "customer_id",
      "amount",
      "qty"
     ],
     "row_index_name": null,